<?xml version="1.0" standalone="no"?>
<!-- Create XML document for Student where it contains the following
data:
Student Name, Personal Info (Address, Birthdate,Gender, Mobile
No, Address) ,Result(Total, Percentage, Grade)
Create External DTD declaration for Student where
• Gender has only two choices Male and Female as an element.
• Grade element should have only one of these grade element
(Pass, First, Dist., Second, Fail) -->

<!DOCTYPE Student SYSTEM "4.dtd">

<Student>
    <Name>Nobita</Name>
    <PersonalInfo>
        <Address>321, Kasukabe, Japan</Address>
        <Birthdate>May 5, 1990</Birthdate>
        <Gender>
            <Male></Male>
        </Gender>
        <MobileNo>555-SHINCHAN</MobileNo>
    </PersonalInfo>
    <Result>
        <Total>350</Total>
        <Percentage>70%</Percentage>
        <Grade>
            <Pass></Pass>
        </Grade>
    </Result>
</Student>
